{"gprv": "0.1",
 "statement": "Figure of the LastWave reconstruction of the forked fBm window, rendered from a working tree with uncommitted changes.",
 "source": [
   {"id": "s1", "description": "The forked dataset fbm_roi.npz.",
    "sourceCitation": {"title": "fbm_roi.npz", "sha256": "5ef928efdec603cb6df541fb750261950914c6077651e2be811285d0b4ee9991"},
    "sourceMetadata": [{"title": "fbm_roi.npz.gprv", "sha256": "PARENT_HASH"}]},
   {"id": "patch", "description": "Uncommitted changes applied to the cited commit.",
    "sourceCitation": {"title": "fbm_recon.png.patch", "sha256": "89d2f53cb663dd407b08221d52c8ae7c18b170d4ae9ec6f8f798edf4eda85ae3"},
    "scope": {"level": "software"}}],
 "processStep": [
   {"id": "p1", "description": "Dyadic wavelet modulus maxima, LastWave dwtrans2d port, J=4, mirror border.",
    "source": ["s1", "patch"], "output": [{"id": "d1"}],
    "processingInformation": {
      "algorithm": [
        {"id": "lw_bank", "description": "FIR analysis/synthesis bank, bit for bit with LastWave convol2.c",
         "citation": {"title": "LastWave FIR bank", "identifier": [{"code": "mz_lastwave.fir_bank", "codeSpace": "geodynamix"}]}},
        {"id": "ext2", "description": "modulus maxima detection, LastWave extrema2",
         "citation": {"title": "extrema2", "identifier": [{"code": "mz_lastwave.extrema2", "codeSpace": "geodynamix"},
                                                          {"code": "10.1109/34.142909", "codeSpace": "doi"}]}}],
      "identifier": {"code": "mz_edges/edges", "codeSpace": "geodynamix"},
      "softwareReference": {"id": "gdx", "title": "GeoDynamix", "edition": "6194b86e5859cf5a4a0d68f8425b8ac8d86d2df8",
                            "otherCitationDetails": ["python 3.12.13", "numpy 2.4.3"],
                            "onlineResource": [{"linkage": "https://github.com/MarioKartUltra/GeoDynamX"}]},
      "runTimeParameters": {"lw_bank": {"border": "mirror", "n_levels": 4}}}},
   {"id": "p2", "description": "Reconstruction from all maxima: LastWave alternating projections, run to convergence.",
    "source": ["d1", "patch"], "output": [{"id": "d2"}],
    "processingInformation": {
      "algorithm": ["lw_bank",
        {"id": "lw_proj", "description": "alternating projections, LastWave ext2_proj.c",
         "citation": {"title": "Alternating projections", "identifier": [{"code": "mz_lastwave.ext2_proj", "codeSpace": "geodynamix"}]}},
        {"id": "w2", "description": "P_Gamma: W2_interp sinh interpolation between anchors",
         "citation": {"title": "W2_interp", "identifier": [{"code": "mz_lastwave.w2_interp", "codeSpace": "geodynamix"}]}},
        {"id": "stop", "description": "stop at relative change < tolerance, residual rising 3 times running, or the cap",
         "citation": {"title": "Converge stop rule", "identifier": [{"code": "mz_lastwave.converge_stop", "codeSpace": "geodynamix"}]}}],
      "identifier": {"code": "mz_edges/recon", "codeSpace": "geodynamix"},
      "softwareReference": "gdx",
      "runTimeParameters": {"stop": {"iterations": 20, "run_mode": "converge", "tolerance": 0.001},
                            "w2": {"clip": false, "kappa": 1}}},
    "report": [{"name": "outcome", "description": {"lw_proj": {"residual": 0.0097}, "snr_db": 29.1,
                                                  "stop": {"iterations": 12, "reason": "converged", "returned": 12}}}]},
   {"id": "p3", "description": "Render the figure.",
    "stepDateTime": "2026-10-01T17:02:44Z",
    "source": ["d2", "patch"],
    "output": [{"id": "o1", "sourceCitation": {"title": "fbm_recon.png", "sha256": "30ffacb5e510f658963f81c97024d9f0ffc1f08c0fd6edfaafa2340f2f384baf"}}],
    "processingInformation": {
      "algorithm": [
        {"id": "mpl", "description": "renderer", "citation": {"title": "matplotlib", "edition": "3.9.2"}}],
      "identifier": {"code": "render", "codeSpace": "geodynamix"},
      "softwareReference": "gdx",
      "runTimeParameters": {"colormap": "gray", "dpi": 300, "extent": [0, 512, 0, 512],
                            "labels": {"x": "x (px)", "y": "y (px)"}, "stretch": "linear"}}}]}
